human,reply
Thank you so much for your support.,Okay sir/mamWe have got two method to hide the network. Steps to hide WiFi SSID From Official website: 1. Go to our website: WorldLink.com.np 2. Click on Online Services 3. Enter your username and online services password on the given field. 4. Click on “UPDATE SSID” Button 5. Check the hide SSID option. 6. Click on “save changes” button. 7. Restart your Router From mobile application. 1. Open myWorldLink application. 2. Tap on left sidebar. 3. Tap on Home Network. 4. Tap on Main Router 5. Tap on the setting icon the right top corner 6. Tap on Change password. 7. Tap on “Wifi”. 8. Check the hide SSID option and tap on “Save”.
Hey,Welcome sir/mam
I want to hide my wifi ssid bro.,Hello sir/mam. How can we assist you?
Thank you so much for your support.,Okay sir/mamWe have got two method to hide the network. Steps to hide WiFi SSID From Official website: 1. Go to our website: WorldLink.com.np 2. Click on Online Services 3. Enter your username and online services password on the given field. 4. Click on “UPDATE SSID” Button 5. Check the hide SSID option. 6. Click on “save changes” button. 7. Restart your Router From mobile application. 1. Open myWorldLink application. 2. Tap on left sidebar. 3. Tap on Home Network. 4. Tap on Main Router 5. Tap on the setting icon the right top corner 6. Tap on Change password. 7. Tap on “Wifi”. 8. Check the hide SSID option and tap on “Save”.
Hi,Welcome sir/mam
Could you guide me to hide the wifi password?,Hello sir/mam. How can we assist you?
Thank you so much for your support.,Sure sir.We have got two method to hide the network. Steps to hide WiFi SSID From Official website: 1. Go to our website: WorldLink.com.np 2. Click on Online Services 3. Enter your username and online services password on the given field. 4. Click on “UPDATE SSID” Button 5. Check the hide SSID option. 6. Click on “save changes” button. 7. Restart your Router From mobile application. 1. Open myWorldLink application. 2. Tap on left sidebar. 3. Tap on Home Network. 4. Tap on Main Router 5. Tap on the setting icon the right top corner 6. Tap on Change password. 7. Tap on “Wifi”. 8. Check the hide SSID option and tap on “Save”.
Hey brother.,Welcome sir/mam
Are you idiot?,Hello sir/mam. How can we assist you?
What?,Pardon sir/mam
I want to know how to hide my wifi ssid name.From Official website,Please mention your query sir.
okay Let me try,From Official website: 1. Go to our website: WorldLink.com.np 2. Click on Online Services 3. Enter your username and online services password on the given field. 4. Click on “UPDATE SSID” Button 5. Check the hide SSID option. 6. Click on “save changes” button. 7. Restart your Router From mobile application. 1. Open myWorldLink application. 2. Tap on left sidebar. 3. Tap on Home Network. 4. Tap on Main Router 5. Tap on the setting icon the right top corner 6. Tap on Change password. 7. Tap on “Wifi”. 8. Check the hide SSID option and tap on “Save”.
Hey worldink,sure sir/mam
I want to know about my online services password.,Hello sir/mam. How can we assist you?
Are you sure it reset my online serviceds password?,Okay sir.To reset your services password: Go to www.worldlink.com.np Click on “Online Services” (https://eservice.worldlink.com.np/login/) Click on “Forgot Password?” (https://eservice.worldlink.com.np/recover/forgot_password) Enter your username and email address/mobile number registered to the username.
Okay,Yes sir. WE are 100% sure. It will reset your online services password.
oi,Okay sir.
I want to know about password.,Hello sir/mam. How can we assist you?
I want to know about my online services password. How can i reset it?,Which password you want to know sir/mam?
Are you sure it reset my online serviceds password?,To reset your online services passwordTo reset your services password: Go to www.worldlink.com.np Click on “Online Services” (https://eservice.worldlink.com.np/login/) Click on “Forgot Password?” (https://eservice.worldlink.com.np/recover/forgot_password) Enter your username and email address/mobile number registered to the username.
Thank you pasa,Above steps will reset your online services password. It will reset your online services password.
Hey brother,welcome sir.
I want know my TV password,Hello sir/mam. How can we assist you?
Are you sure it reset my online serviceds password?,Okay sir.To reset your services password: Go to www.worldlink.com.np Click on “Online Services” (https://eservice.worldlink.com.np/login/) Click on “Forgot Password?” (https://eservice.worldlink.com.np/recover/forgot_password) Enter your username and email address/mobile number registered to the username.
Okay,Yes sir. WE are 100% sure. It will reset your online services password.
Hi,Okay sir.
I want know web login password,Hello sir/mam. How can we assist you?
Are you sure it reset my online serviceds password?,To reset your  password: Go to www.worldlink.com.np Click on “Online Services” (https://eservice.worldlink.com.np/login/) Click on “Forgot Password?” (https://eservice.worldlink.com.np/recover/forgot_password) Enter your username and email address/mobile number registered to the username.
Okay,Okay sir.
Hey my internet is not working.,Please mention your query.
Sala Kutta kamina.,If you continue using such offensive and vulgar words to seek our assistance. We will be compelled to blacklist you from Online Support services. Thank You!
Oi sale khate,If you continue using such offensive and vulgar words to seek our assistance. We will be compelled to blacklist you from Online Support services. Thank You!
Oi mug,If you continue using such offensive and vulgar words to seek our assistance. We will be compelled to blacklist you from Online Support services. Thank You!
Madargat,If you continue using such offensive and vulgar words to seek our assistance. We will be compelled to blacklist you from Online Support services. Thank You!
Fuck you,If you continue using such offensive and vulgar words to seek our assistance. We will be compelled to blacklist you from Online Support services. Thank You!
Hey bitch,If you continue using such offensive and vulgar words to seek our assistance. We will be compelled to blacklist you from Online Support services. Thank You!
Hi mother fucker,If you continue using such offensive and vulgar words to seek our assistance. We will be compelled to blacklist you from Online Support services. Thank You!
"Tero tauko, your head",We created page of WorldLink Communications Ltd. to be an authentic and safe place for providing support and information for our valued customers. We apologize for the inconvenience that you had to face but we strongly disagree with the use of offensive and abusive words.
Hello son of the bitch,We created page of WorldLink Communications Ltd. to be an authentic and safe place for providing support and information for our valued customers. We apologize for the inconvenience that you had to face but we strongly disagree with the use of offensive and abusive words.
Hey bhaster,We created page of WorldLink Communications Ltd. to be an authentic and safe place for providing support and information for our valued customers. We apologize for the inconvenience that you had to face but we strongly disagree with the use of offensive and abusive words.If you continue using such offensive and vulgar words to seek our assistance. We will be compelled to blacklist you from Online Support services. Thank You!
"Hey bhaster, kutta kamina, tero tauko, fuck, o fuck",We created page of WorldLink Communications Ltd. to be an authentic and safe place for providing support and information for our valued customers. We apologize for the inconvenience that you had to face but we strongly disagree with the use of offensive and abusive words.If you continue using such offensive and vulgar words to seek our assistance. We will be compelled to blacklist you from Online Support services. Thank You!
"Hey, worldlink.",Hello sir. How can we assist you?
It has been already a month when my issue will be solve.,Please elaborate your query sir.
For how many times i have to update my issue.,We will ensure you your issue will be solve as soon as possible. Please mention your query sir.
Fuck you,We created page of WorldLink Communications Ltd. to be an authentic and safe place for providing support and information for our valued customers. We apologize for the inconvenience that you had to face but we strongly disagree with the use of offensive and abusive words.If you continue using such offensive and vulgar words to seek our assistance. We will be compelled to blacklist you from Online Support services. Thank You!
Gm,Good Morning and Namaste sir/mam ! Could you please reply us back with your Username? We will make sure everything will be taken care of ! Thank you.
Gud Morning,"Hello and Good Morning Sir/Ma’am,"
I have been facing issue.,Please elaborate your query sir/mam.
None of the lights is glowing in my router.,Is your router adaptor connected with the main electic source?
well now i am far from the home.,Please do update us when you are near to your router sir.
Sure sir.,Okay sir/mam
Hey,Good Morning sir/mam how can we assist you?
My internet is going to be expire. Can i extend my connection for the few days?,Sure mam/sir.We have a limited number of employees available on accounts department on off days. You can use SMS extend or use myWorldlink app to enable your account for 3 days. You can pay your due amount after three days.
Okay,Okay sir/mam
I am facing issue of photo upload from the mobile application.,You want to upload your document to the server from the web application.
Yes,"Steps for uploading document: 1. Click on Online Service. 2. Enter your username and password. 3. Click on ""Update Contact details"". 4. Click on ""Browse"" to upload document (Max size is 512kb). 5. Click on ""UPDATE"""
Thank you,welcome sir/mam
hi,Hello Respected Customer.How can we assist you?
I have recently paid all the due. But my account seem to be deactiavte.,Have you upload your all data to our server?
No i haven't upload all the documents.,"Steps for uploading document1. Click on Online Service. 2. Enter your username and password. 3. Click on ""Update Contact details"". 4. Click on ""Browse"" to upload document (Max size is 512kb). 5. Click on ""UPDATE"""
If i upload all my document. Is this issue will stop?,Yes sir/mam.
Okay sir,Okay sir/mam
Hi,Hello sir/mam how can we assist you?
Today i notice that my document is not upload in the server. How can i upload it?,Well do you use worldlink mobile application.
Yes sir,"Steps for uploading document1. Click on Online Service. 2. Enter your username and password. 3. Click on ""Update Contact details"". 4. Click on ""Browse"" to upload document (Max size is 512kb). 5. Click on ""UPDATE"""
Thank you,Welcome
My internet is not working.,How far are you from the router?
I am one floor down.,Please go near to the router and update us how many lights are glowing in your router?
Please wait for the while sir,Take your time sir/mam.s
There is only one light glowing in the power.,Please reboot your router and check after a while.
Okay sir,Okay sir/mam
Hey my internet is not working.,Hello sir/mam how can we assist you?
All the lights are glowing but my wifi ssid is not showing.,Please reboot your router and check after a while.
Oky,Okay sir
Hey buddy,Hello sir/mam. How can we assist you?
I have been suffering from the serious internet issue.,Please elaborate your query sir/mam.
My internet is not working. I wire has been cut off by the vehicle.,We recommend you to contact our technical support at 9801523051 to get the necessary assistance.
Can't you help?,"We do, It will be more helpfull if you contact above number."
Okay,Okay sir/mam
Hey stupsid dump,Hello sir/mam. How can we assist you?
I want to extend my connection.,Please elaborate your query sir.
I want to add the secondary router sir.,Do you have the secondary router?
Yes sir i do.,"1. Connect your secondary router to your PC with the help of LAN cable.2. Access your secondary router with the default gateway IP address of your router. 3. Login with the default username and password for the router. 4. Go to Wireless settings to set up your WiFi SSID and password. 5. Go to Network settings and make the DHCP disable. 6.  Reboot  your  router  to  save  the  changes. 7. Connect your secondary router's LAN port to the LAN port 1 of the primary router(i.e, ONU device) with the help of LAN cable. If you are still not able to configure your router, please visit our nearest branch office along with your secondary router and its power adapter."
Thank you,Welcome sir/mam
Hey i want to add the secondary router. Can i do that?,Sure sir you can. Do you know how to connect the scondary router?
No i don't. Can you guide me to configure the secondary router?,"sure sir1. Connect your secondary router to your PC with the help of LAN cable. 2. Access your secondary router with the default gateway IP address of your router. 3. Login with the default username and password for the router. 4. Go to Wireless settings to set up your WiFi SSID and password. 5. Go to Network settings and make the DHCP disable. 6.  Reboot  your  router  to  save  the  changes. 7. Connect your secondary router's LAN port to the LAN port 1 of the primary router(i.e, ONU device) with the help of LAN cable. If you are still not able to configure your router, please visit our nearest branch office along with your secondary router and its power adapter."
thank you brother,Welcome sir/mam
Hey I want to extend my connection so that it can also be work in the fifth floor.I do have the secondary router of the TPLINK.,"1. Connect your secondary router to your PC with the help of LAN cable.2. Access your secondary router with the default gateway IP address of your router. 3. Login with the default username and password for the router. 4. Go to Wireless settings to set up your WiFi SSID and password. 5. Go to Network settings and make the DHCP disable. 6.  Reboot  your  router  to  save  the  changes. 7. Connect your secondary router's LAN port to the LAN port 1 of the primary router(i.e, ONU device) with the help of LAN cable. If you are still not able to configure your router, please visit our nearest branch office along with your secondary router and its power adapter."
Okay let me check,Sure sir
Hey in the web appplication there seems to be red light in the power of my connection.,We recommend you to contact our technical support at 9801523051 to get the necessary assistance.
Okay,Okay sir/mam
oi worldlink my internet is not working.,How far are you from the router sir?
I am attatch to my router.,Is there light on AUTH and LINK on your ONU device? Please check and inform us back.
No sir there is no light.,"There seems to be a physical issue in the connection, for which we have informed your concerned branch to send technicians to your place to resolve the issue. The field technicians will contact you prior to the visit."
Hey worldlink.,Hello sir/mam how can we assist you?
I am facing slow internet connection.,How far are you from the router?
I am near to my router.,"All the settings  in your connection seems perfectly normal. Sir, could you please check your download/upload bandwidth from www.speedtest.net ?"
Okay Please wait for the while.,Okay sir
Well its working,Okay sir
Hey,Hello sir/mam how can we assist you?
Please refresh my connection.,We have reconfigured your router.Could you please check the internet speed through www.speedtest.net using Ethernet cable in your pc or laptop and share the screenshot of  speed test result with us. It would be helpful for us to further diagnosis the issue.
Thanks a lot,Welcome sir/mam
Hello,Hello sir/mam how can we assist you?
I am facing slow internet connection.,How far are you from the router?
I am in the office now. I certainly face slow internet connection.,If you are in office how could you know your internet in slow?
When i was at home early morning. My internet was slow.,Please update us your query when you are near to your router sir/mam. It will be more helpfull to solve the issue.
Okay sir.,Okay sir/mam
hi,Hello sir/mam how can we assist you?
I am facing slow internet connection. I am near to my router.,We have reconfigured your router.Could you please check the internet speed through www.speedtest.net using Ethernet cable in your pc or laptop and share the screenshot of  speed test result with us. It would be helpful for us to further diagnosis the issue.
Hey my intenet in working slow.,Please elaborate your issue sir/mam.
I am not getting the speed i am paying amount to you.,"5Mbps = 5120Kbps5120Kbps /8 = 640 KBps Well, since you have subscribed to our bandwidth in Bits per second. Then your actual download/upload speed should be the division of your subscribed internet speed by 8 [since 1 byte = 8 bit ] to get your speed in bytes per second (KBps). For example, If you subscribe the internet of 5 Mbps (Megabit per second) which is [ 5*1024=5120 Kbps (kilobits per second)] , then the download/upload speed should be around (5120/8) KBps i.e around 640 KBps (kilobytes per second).The download speed you are getting is in BYTES and the internet speed you are subscribed in BITS. It takes 8 BITS of Internet speed to download 1 BYTE of file size. But, while testing speed if you are not getting full BANDWIDTH, there could have been some issues, we can look into it and fix it for you.Sir, Download speed matters by BITS and BYTES factors. It take 8BITS of Internet speed to download 1BYTE of data. If you take 5mbps plan your internet speed will be 5120KBITS.Sir, it also depends very much  on the destination servers to which you are uploading your files too."
I am not getting the speed while download the software.,"5Mbps = 5120Kbps5120Kbps /8 = 640 KBps Well, since you have subscribed to our bandwidth in Bits per second. Then your actual download/upload speed should be the division of your subscribed internet speed by 8 [since 1 byte = 8 bit ] to get your speed in bytes per second (KBps). For example, If you subscribe the internet of 5 Mbps (Megabit per second) which is [ 5*1024=5120 Kbps (kilobits per second)] , then the download/upload speed should be around (5120/8) KBps i.e around 640 KBps (kilobytes per second).The download speed you are getting is in BYTES and the internet speed you are subscribed in BITS. It takes 8 BITS of Internet speed to download 1 BYTE of file size. But, while testing speed if you are not getting full BANDWIDTH, there could have been some issues, we can look into it and fix it for you.Sir, Download speed matters by BITS and BYTES factors. It take 8BITS of Internet speed to download 1BYTE of data. If you take 5mbps plan your internet speed will be 5120KBITS.Sir, it also depends very much  on the destination servers to which you are uploading your files too."
"Hey, i am not getting the speed that i supposed to get as well as i have facing issue in the connection.",Please elaborate your query sir.
I am using torrent and my internet is slow.,"Internet is provided in bits where as your download speed is displayed in Bytes. The average download speed of 5 Mbps (Megabits ) is 640 KBps ( KiloBytes). But it also may vary according to seeds and peers as well as server you're downloading from. Please inbox us your username. We will look into your issue.Sir/mam, Number of seeds and peers do affects the download reliability with respond to it's number. Greater seed/peer, the download ratio increase as per it. Perhaps, bandwidth that you have subscribed to is always that matters with the download speed. If the file you want to download have seeds and peers around 100 then according to your bandwidth subscribed your download should be around 640 KBps (which is equal to 5 Mbps) . Since there was just 50kbps download from your router, there must be an issue with it's throughput. Sir/mam, no ISP can guarantee the download speed you get in torrent. Its illegal to begin with, in many countries.  There is no specific server to store a torrent file. Bits and fragments of the file are scattered all over the world in the PC's of people who download those torrent files as seeders and leechers. People(leachers) download from you, when you are seeding a file. So the download speed from torrent very much depends on the number of seeders and leechers associated with the torrent file and the route to them.Well, since most of the downloader (eg IDM, torrent) shows the download speed in Byte per second but you have subscribed to our bandwidth in Bit per second. Then your actual download speed should be the division of your subscribed internet speed by 8 [since 1 byte = 8 bit ]. For example, If you subscribe the internet of 25 Mbps (Megabit per second) , then the download speed should be around (25/8) KBps i.e around 3.25MBps (MegaByte per second)."
ummm,Okay sir/mam
"Worldlink, I am facing slow internet connection.",Please elaborate your query sir.
I check the speed of my connection from the different speedtest and it shows the full speed  but while i ma downloading the content from the web site. It is downloading in 23 KB/s.,Please reboot your router and check.
I have already reboot the router and check.,Sir/mam If you don't mind please pause the download and download the demo ubuntu disk image from the concern web site.
Okay please wait for the while.,Okay sir/mam
The downloaing speed is good in that concern website.,Sir/mam the download speed also matter from the server.If the server has limit the speed. We can't do anything. As you have already tested the speed as well as the download speed of the other site too. There is no issue from the ISP site.
Thank you for your coorporation and guidance.,Welcome sir.
Hey worldink. I want to know about your FUP Policy.,"Sir, FUP is right that every ISP reserve. We are sure sooner or later it is going to be implemented by any ISPs according to their needs and requirements. So on with the increasing number of clients in WorldLink We intend to provide the best possible Internet experience to all our customers. For this, we rely on customers being fair in the way they use the Internet. This ""Fair Usage Policy"" is here to give us an option that if usage of any unlimited customer is excessive over a period of time to the point, it impacts on other users experience then the bandwidth will be capped to fallback speed and is effective only during peak hours (8PM to 11PM) whereas the speed remain unchanged beside mentioned timing.All of our valued clients must be able to use equal service. Here, FUP is an option to provide such solutions. There are so many users found they have been misusing internet e.g taking a connection for home and have been using for HOSTELS, HOTELS, RESTAURANTS, Multiple sharing and for other business purposes. If you take a deep look into it a normal users never falls under FUP but all those bandwidth abusers and massive users.Let us take 5 Mbps package, when the internet usage exceeds the Daily FUP limit of 10 GB then FUP will be applied during the Daily peak hours ( i.e. 8 PM to 11 PM ), then the respective User will be notified via SMS and E-Mail. This will be done 3x3 times for every 10GB bandwidth usage during the Daily Peak Hours with SMS & Email Alert. For the next 3 times of 10 GB bandwidth usage, the bandwidth will then be capped to Fallback Speed ( 1 Mbps) but Users can reset the speed back to normal through Mobile App or visiting our Website. If the user continues with excessive use then the bandwidth will be capped again permanently ( i.e for 3 hours).when the internet usage is seen excessive then the respective users will be notified via SMS and E-Mail for 3 times, Users can reset the speed back to normal via bandwidth selector option available in online service or mobile app for next 3 times. FUP will be abolished as user manage his/her daily usage, If continuous excess usage is seen then the bandwidth will be capped permanently( i.e 8PM-11PM hours only).Dear sir, Its warning message for all of our customers with excessive internet usage. FUP have not been implemented. Whereas FUP policy is a worldwide policy and also mentioned in point no. 20 of terms and conditions.Let us take 5Mbps package, When the internet usage exceeds the Daily FUP limit of 28 GB within the Daily peak hours (i.e. 8PM-11PM), then the respective User will be notified via SMS and email. This will be done 3*3 times for every 28GB bandwidth usage during the Daily Peak Hours with SMS and Email Alert. For the next 3 times of 28GB bandwidth usage, the bandwidth will then capped to Fallback Speed (3Mbps) but Users can reset the speed back to normal through Mobile App or visiting our Website. If the user continues with excessive use then the bandwidth will be capped again permanently (i.e. for 3 hours)At peak times, a lot of customers use the shared network bandwidth at any one time.This means that service quality for all users is affected, making it slower for everyone to access the internet or send and receive emails, especially at peak times. Peak times may fluctuate between 8 pm to 11 pm. 5mbps- 20gb in 24hours- 1mbps fallback 10mbps- 24gb in 24hours- 2mbps fallback 20mbps- 28gb in 24hours- 3mbps fallback 25mbps- 32gb in 24hours- 4mbps fallback 30mbps- 36gb in 24hours- 5mbps fallback 35mbps- 36gb in 24hours- 5mbps fallback 40mbps- 36gb in 24hours- 5mbps fallback 50mbps- 40gb in 24hours- 6mbps fallback 55mbps- 40gb in 24hours- 6mbps fallback 60mbps- 40gb in 24hours- 6mbps fallback FUP is applied only  if an excessive amount of data has been used in an account. Our FUP is applicable only from 8pm to 11 pm."
